{
  "schema_version": "1.0.0",
  "nodes": [
    {
      "node_id": "node-1",
      "type": "L3",
      "name": "Order Management",
      "parent_id": null,
      "roles": ["order-processing"],
      "inputs": [
        { "name": "customer-order", "type": "OrderRequest" }
      ],
      "outputs": [
        { "name": "order-confirmation", "type": "OrderConfirmation" }
      ],
      "rasci": "R",
      "source_refs": ["arch-doc#section-3"],
      "rules_refs": ["rule-001"]
    }
  ],
  "relationships": [
    {
      "from_node_id": "node-1",
      "to_node_id": "node-2",
      "type": "sequence"
    }
  ],
  "metadata": {}
}
